{
  "api_version": "agent-platform/v1alpha1",
  "kind": "ToolManifest",
  "metadata": {
    "id": "tol_0198f6d0-7ef0-7b0e-a0d3-5f9c96c7f411",
    "key": "git-read-tool",
    "namespace": "development",
    "version": "1.0.0",
    "revision": 1,
    "scope": {
      "type": "tenant",
      "tenant_id": "ten_0198f6d0-7ef0-7b0e-a0d3-5f9c96c7f411"
    },
    "labels": {
      "provider": "git",
      "capability": "read"
    },
    "annotations": {},
    "content_digest": "sha256:a1b2c3d4e5f6a1b2c3d4e5f6a1b2c3d4e5f6a1b2c3d4e5f6a1b2c3d4e5f6a1b2",
    "created_at": "2026-09-01T00:00:00Z",
    "created_by": {
      "actor_type": "user",
      "actor_id": "usr_0198f6d0-7ef0-7b0e-a0d3-5f9c96c7f411",
      "tenant_id": "ten_0198f6d0-7ef0-7b0e-a0d3-5f9c96c7f411"
    }
  },
  "spec": {
    "provider": "git",
    "capability": "repository.read",
    "domain": ["development", "version_control"],
    "transport": "local",
    "endpoint_ref": {
      "service_id": "git_service",
      "endpoint_key": "api.v1.repository.read"
    },
    "input_schema_ref": {
      "id": "sch_git_read_input",
      "version": "1.0.0",
      "digest": "sha256:e3b0c44298fc1c149afbf4c8996fb92427ae41e4649b934ca495991b7852b855"
    },
    "output_schema_ref": {
      "id": "sch_git_read_output",
      "version": "1.0.0",
      "digest": "sha256:a7ffc6f8bf1ed76651c14756a061d662f580ff4de43b49fa82d80a4b80f8434a"
    },
    "side_effect": "read_only",
    "risk_level": "low",
    "idempotency": {
      "supported": true,
      "key_scope": "tool_target",
      "duplicate_semantics": "return_original"
    },
    "timeout_policy": {
      "connect_timeout_seconds": 5,
      "execution_timeout_seconds": 30
    },
    "retry_policy": {
      "max_attempts": 3,
      "retryable_error_codes": ["TIMEOUT", "RATE_LIMITED", "NETWORK_ERROR"],
      "backoff": "exponential",
      "base_delay_seconds": 1,
      "requires_safe_to_retry": true
    },
    "rate_limit": {
      "requests": 100,
      "per_seconds": 60
    },
    "execution_location": "local",
    "approval_requirement": {
      "mode": "none",
      "conditions": []
    },
    "health_contract": {
      "healthcheck_key": "git_service_health",
      "interval_seconds": 30,
      "unhealthy_after_failures": 3
    }
  },
  "status": {
    "phase": "active",
    "observed_revision": 1,
    "activated_at": "2026-09-01T00:00:00Z"
  }
}
